{
  "$schema": "../../schemas/environment.schema.json",
  "schemaVersion": 1,
  "name": "production",
  "azure": {
    "subscriptionId": "eb1b0038-3a72-459d-884c-ba2820dc53cc",
    "tenantId": "f1c96730-73a1-4159-81ab-0bb6731c8e75",
    "location": "australiaeast",
    "platformResourceGroup": "rg-platform-production",
    "containerRegistryName": "acriacvalidation001",
    "containerRegistryLoginServer": "acriacvalidation001.azurecr.io",
    "containerRegistryRoleAssignmentMode": "AbacRepositoryPermissions"
  },
  "workloads": {
    "access-control-demo": {
      "resourceGroup": "rg-platform-production",
      "stack": "single-container-web",
      "repository": "braddlesunravels/access-control-demo",
      "repositoryId": "1298659298",
      "repositoryOwnerId": "103235805",
      "containerRepository": "access-control-demo",
      "containerAppsEnvironmentName": "acae-access-control-demo-production",
      "containerAppName": "aca-access-control-demo",
      "logAnalyticsWorkspaceName": "log-access-control-demo",
      "keyVaultName": "kv-acd-prod-braddles",
      "runtimeIdentityName": "id-access-control-demo-secrets",
      "publisherIdentityName": "id-access-control-production-publisher",
      "plannerIdentityName": "id-access-control-production-planner",
      "deployerIdentityName": "id-access-control-production-deployer",
      "customDomainName": "aca.braddlesunravels.online",
      "certificateResourceId": "/subscriptions/eb1b0038-3a72-459d-884c-ba2820dc53cc/resourceGroups/rg-platform-production/providers/Microsoft.App/managedEnvironments/acae-access-control-demo-production/managedCertificates/mc-aca-access-control-demo-placeholder",
      "allowedSecretNames": [
        "access-gate-code-secret",
        "access-gate-cookie-secret",
        "next-supabase-publishable-key",
        "next-supabase-url"
      ],
      "migrationSecretNames": [
        "supabase-access-token",
        "supabase-db-password"
      ],
      "externalEnvironmentVariables": [],
      "bounds": {
        "targetPorts": [
          3000
        ],
        "minReplicas": {
          "minimum": 1,
          "maximum": 1
        },
        "maxReplicas": {
          "minimum": 1,
          "maximum": 1
        },
        "healthProbePaths": [
          "/api/health"
        ],
        "cpu": [
          "0.25"
        ],
        "memory": [
          "0.5Gi"
        ]
      }
    }
  }
}
